{
  "schema_id": "radi144_materialized_projection_migration_implementation_decision_v1",
  "decision": "defer_migration_implementation_until_table_creation_gate",
  "status": "migration_implementation_decision_recorded_no_revision",
  "migration_implementation_decision_recorded": true,
  "alembic_migration_enabled": false,
  "projection_storage_tables_enabled": false,
  "orm_model_enabled": false,
  "projection_write_service_enabled": false,
  "worker_projection_materialization_enabled": false,
  "required_future_gate": "radi144_materialized_projection_table_creation_gate_decision",
  "implementation_preconditions": [
    "migration_enablement_decision_recorded",
    "table_creation_policy_reviewed",
    "foreign_key_restrict_cascade_policy_reviewed",
    "unique_active_projection_index_reviewed",
    "downgrade_strategy_reviewed",
    "tenant_isolation_migration_test_plan_defined",
    "write_service_still_blocked"
  ],
  "required_invariants": [
    "decision_only_no_alembic_revision",
    "decision_only_no_database_table",
    "decision_only_no_orm_model",
    "decision_only_no_write_service",
    "no_worker_projection_materialization",
    "api_read_projection_remains_on_demand",
    "stored_result_payload_remains_source_of_truth",
    "raw_debug_columns_forbidden"
  ]
}
